,student_name,institution,year,dissertation_title,advisors
2949,Marharyta Petukh,Clemson,2015,Modeling ions and  protein binding in chronic beryllium disease,Emil Alexov
2950,Lin Wang,Clemson,2015,Developing methods for pKa calculations,Emil Alexov
2951,Slaven Radic,Clemson,2015,Biophysical interaction between nanoparticles and biomolecules,Emil Alexov
2952,Michael Stephen Jablin,CMU,2015,Tilt-dependent analysis of diffuse x-ray scattering from oriented stacks of fluid phase lipid bilayers,John Nagle
2953,Elijah Lane Bogart,Cornell,2015,Nonlinear constraint-based modeling of the function and evolution of C4 photosynthesis,Chris Myers
2954,Daniel Benjamin Reeves,Dartmouth,2015,Nonequilibrium dynamics of magnetic nanoparticles in biomedical applications,John B. Weaver
2955,Derya Meral,Drexel,2015,Molecular dynamics studies of intrinsically disordered peptides and proteins,Birgita Urbanc
2956,Frank Jones,Drexel,2015,Relationship between Age-Related Cognitive Impairment and Anatomical Changes in Dendritic Bundles and Neuronal Microcolumns in the Prefrontal Cortex,Luis Cruz Cruz
2957,Max Henderson,Drexel,2015,The Effects of Aging on Neural Processes and Microcolumnar Networks,Luis Cruz Cruz
2958,Sargis Karapetyan,Duke,2015,Design principles and coupling of biological oscillators,Nicolas Buchler
2959,Vijay Singh,Emory,2015,Towards the understanding of network information processing in biology,Ilya Nemanman
2960,Vindu Wathsala Kathriarachchi,Florida Atlantic,2015,Effect of processing temperature on the properties of nanophase Fe-substituted hydroxyapatite,Theodora Leventouri
2961,Anirbaan Mukherjee,Florida International,2015,Macular pigment and lens optical density measurements,Richard Bone
2962,Zrinka Greguric Ferencek,George Mason,2015,Long-lived spatiotemporal structures in driven systems,John R. Cressman
2963,Chenghang Du,George Washington,2015,"Dynamics, structure and evolution of biological networks",Chen Zeng
2964,Adam S. Hughes,George Washington,2015,Biosensing on the end of an optical fiber,Mark Reeves
2965,Hui Yu,Georgia,2015,Femtosecond time-resolved spectroscopy study of excited state dynamics,Susanne Ullrich
2966,Dan Kovari,Georgia Tech,2015,Investigations of the spreading and closure mechanisms of phagocytosis in J774a.1 macrophages,Jennifer Curtis
2967,Le Tung,Georgia Tech,2015,Single-molecule biophysics of DNA bending: looping and unlooping,Harold Kim
2968,Andrzej Kazimierz Nowojewski,Harvard,2015,Pathogen avoidance by Caenorhabditis elegans is a pheromone-mediated collective behavior,Erel Levine
2969,Maxim Laverentovich,Harvard,2015,"Diffusion, Absorbing States, and Nonequilibrium Phase Transitions in Range Expansions and Evolution.",David Nelson
2970,Shahla Nemati,Idaho,2015,Eliciting the effects of cellular noise on growth,Andreas Vasdekis
2971,Seongjin Park,Illinois,2015,Cellular responses to external threats probed by super-resolution microscopy,Taekjip Ha
2972,Sukrit Suksombat,Illinois,2015,Binding configurations of single-stranded DNA binding protein,Yann Chemla
2973,Hannah Gelman,Illinois,2015,Cellular influence on protein folding),Martin Gruebele
2974,Vasilica Crecea,Illinois,2015,Magneomotive optical coherence elastography for biomedical applications,Stephen A. Boppart
2975,Lalit Dubey,Illinois-Chicago,2015,Molecular dynamics  studies of the PKCa-C2 domain bound to mixed lipid membranes,Mark Schlossman
2976,Miroslave N. Mihaylov,Illinois-Chicago,2015,X-ray investigations of mixed charge amphiphilic systems,Mark Schlossman
2977,Nicholas M. Timme,Indiana,2015,Connectivity and information processing in cortical and hippocampal cultures,John Beggs
2978,Emily Miller,Indiana,2015,Exploring a network’s topological parameter space in search of critical dynamics,John Beggs
2979,Christopher Knorowski,Iowa State,2015,Dynamics and statics of polymer nanocomposite self-assembly via molecular dynamics,Alex Travesset
2980,Mao Ye,Johns Hopkins,2015,Blinking in quantum dots and endothelial cells under curvature and shear stress,Peter Searson
2981,Allen Eastlund,Kansas,2015,Revealing remodeler function,Christopher Fischer
2982,Piotr Popov,Kent State,2015,"Liquid crystal interfaces: experiments, simulations and biosensors",Elizabeth Mann | Antal Jakli
2983,Haosu Tang,Lehigh,2015,"Computational modeling of 3D actin organization thorough turnover, crosslinking and motor pulling",Dimitrios Vavylonis
2984,Pirbhai Massooma,Lehigh,2015,Influence of bio-functionalized single walled carbon nanotubes on neural stem cells,Vyacheslav Rotkin | Sabrina Jedlicka
2985,Garret M. Pitcher,LSU,2015,Design and validation of a prototype collimation system with reduced applicator weights for Elekta electron therapy beams,Kenneth Hogstrom
2986,Michael J. Mlodzianoski,Maine,2015,Spectral measurements and super resolution imaging of single molecules for fluorescence photoactivation localization microscopy,Sam Hess
2987,Joshu Parker,Maryland,2015,Characterizing the complex spatial patterns of biological systems,Wolfgang Losert
2988,King Lam Hui,Maryland,2015,Mechanobiology of T-cell activation,Arpita Upadhyaya
2989,Mikheil Azatov,Maryland,2015,The role of actin networks in cellular mechanosensing,Arpita Upadhyaya
2990,Daniel E. Wilcox,Michigan,2015,Chasing charge transfer in organic systems,Jennifer P. Ogilvie
2991,Jacob Clifford,Michigan State,2015,Analysis of cooperative transcription factor binding at the sequence level,Chris Adami
2992,Kwang Ho Hur,Minnesota,2015,Advancing fluorescence fluctuation microscopy in living cells,Joachim Mueller
2993,Elizabeth Myhra Smith,Minnesota,2015,Quantitative fluorescence studies in living cells,Joachim Mueller
2994,Raghavendar Reddy Sanganna Gari,Missouri,2015,Structural Investigations of the protein export system at the single molecule level,Gavin King
2995,Miao Zhang,Missouri,2015,"Towards high-speed, high-sensitivity optical coherence tomography for in vivo functional imaging",Ming Yu
2996,Dawn Michelle King,Missouri – St. Louis,2015,Evolutionary dynamics of speciation and extinction,Sonya Bahar
2997,Samuel Ocko,MIT,2015,Studies in Living Porous Media,Mehran Kardar | Lakshminarayanan Mahadevan
2998,Tatiana Artemova,MIT,2015,The role of cooperation and dispersal in the evolution of antibiotic resistance,Jeff Gore
2999,Apratim Sahay,MIT,2015,Investigating the competing endogenous RNA hypothesis genome-wide and in single cells,Jeff Gore | Alexander van Oudenaarden
3000,Yannan Zheng,MIT,2015,Quantification of microRNA regulation,Jeff Gore | Alexander van Oudenaarden
3001,Evgene Yurtsev,MIT,2015,Cooperative behaviors in the evolution of antibiotic resistance,Jeff Gore
3002,Ramaninder K. Brar,New Mexico State,2015,Applied radiation physics: the use of x-rays for the development of  new insect sterilization protocols,Jacob Urquidi
3003,Jing Shang,North Carolina,2015,Development of a stationary chest tomosynthesis system using carbon nanotube arrays,Otto Zhou
3004,Lukas Dylan Osborne,North Carolina,2015,Biophysics of cancer progression and high-throughput mechanical characterization of biomaterials,Richard Superfine
3005,Maedeh Heidarpourroushan,North Carolina State,2015,Dynamics of DNA Looping in nanochannels,Robert Riehn
3006,Pooyan Sahbaee Bagherzadeh,North Carolina State,2015,Patient-specific image quality and dose estimation for contrast enhanced CT,Ehsan Samei
3007,Jialin Li,Northeastern,2015,Complex DNA binding kinetics of HIV-1 nucleocapsid proteins,Mark C. Williams
3008,Susan Dina Ghiassian,Northeastern,2015,Network medicine: a network-based approach to human disease,Alberto Laszlo-Barabasi
3009,Jennifer Anne Hobbs,Northwestern,2015,Patterns Of Contact Across The Rat Vibrissal Array: First Steps Toward Quantifying The Vibrissotactile Natural Scene,Mitra Hartmann
3010,Jan Smrek,NYU,2015,Fractal properties of DNA,Alexander Grosberg
3011,Ameneh Mohammadalipour,Ohio University,2015,Mechanical properties of cancer cells,David Tees
3012,Yang Liu,Ohio University,2015,Measurement of force dependence of receptor-ligand bonding using a novel forced unbinding system,David Tees
3013,Rami M.A. Amro,Ohio University,2015,Nonlinear stochastic dynamics and signal amplification in sensory hairy cells,Alexander Neiman
3014,Richelle M. Teeling-Smith,Ohio State,2015,Single molecule EPR and other sensing and imaging applications with nitrogen-vacancy nanodiamond,Chris Hammel
3015,Kenji Oman,Ohio State,2015,Nucleic acid high-throughput sequencing studies present unique challenges to analysis and interpretation,Ralf Bundschuh
3016,Yi-Hsuan Lin,Ohio State,2015,The interplay between single-stranded binding proteins on RNA secondary structure,Ralf Bundschuh
3017,Yangzhong Qin,Ohio State,2015,Ultrafast hydration dynamics probed by tryptophan at protein surface,Dongping Zhong
3018,Penhui Lin,Oklahoma State,2015,Application of NMR to protein structure and protein-ligand studies,Donghua Zhou
3019,Lian Duan,Oklahoma State,2015,Investigation of membrane protein structure by NMR,Donghua Zhou
3020,Amanda Taylor,Oklahoma State,2015,Structural and chemical studies of bone using solid state NMR,Donghua Zhou
3021,Matthew Lionel Jemielita,Oregon,2015,Imaging bacterial population dynamics in the zebrafish intestine,Raghuveer Parthasarathy
3022,Tristan Hormel,Oregon,2015,The microrheology of lipid bilayers,Raghuveer Parthasarathy
3023,Jeff B. Schulte,Oregon State,2015,Hard spheres within classical density functional theory and Min proteins in Escherichia coli,David J. Roundy
3024,Vincent Michele Rossi,Oregon State,2015,Digital Fourier holographic microscopy,Steve Jacques
3025,Jing Cai,Pennsylvania,2015,Superior to one of glass: natural gradient index lenses via patchy particle assembly,Alison Sweeney
3026,Olivia M. Padovan-Merhar,Pennsylvania,2015,Single human cells use transcriptional mechanism to compensate for differences in cell size and DNA content,Arjun Raj
3027,Han Yong Ban,Pennsylvania,2015,"Spatially dense, multi-spectral, frequency-domain diffuse optical tomography of breast cancer",Arjun Yodh
3028,Wesley Boehs Baker,Pennsylvania,2015,Optical cerebral blood flow monitoring of mice to men,Arjun Yodh
3029,Nicholas Kybert,Pennsylvania,2015,Nano-bio hybrid sensors for chemical detection and disease diagnostics,Charlie Johnson
3030,Isaac Michael Carruthers,Pennsylvania,2015,Encoding of ultrasonic communication signals in rat auditory cortex,Maria Neimark Geffen
3031,Phillip B. Schafer,Penn State,2015,Neuroscience-inspired computational systems for speech recognition under noisy conditions,Dezhe Jin
3032,Zhongyao Sun,Penn State,2015,Analysis and logical modeling of biological signaling transduction networks,Reka Albert
3033,Andrew Magyar,Penn State,2015,Statistics of single unit responses in the human medial temporal lobe,John C. Collins
3034,Garret Nolan Evans,Penn State,2015,Two projects in theoretical neuroscience: a convolution-based metric for neural membrane potentials and a combinatorial connectionist semantic network method,John C. Collins
3035,Jeffrey P. Nguyen,Princeton,2015,The role of mreb in E. coli shape determination and whole-brain calcium dynamics in C. elegans,Joshua Shaevitz
3036,Eric Michael Smith,Princeton,2015,Scaling and regulation of gene expression in the developing fly embryo,Thomas Gregor
3037,Sara Rosenthal,Princeton,2015,Collective sensing and information transfer in animal groups,Iain Couzin
3038,Daniel Allen Hartzler,Purdue,2015,Triplet excitons in natural photosynthetic light harvesting systems,Sergei Savikhin
3039,Ajith Rajapaksha,Purdue,2015,The effect of macromolecular crowding on the structure of the protein complex superoxide dismutase,Brian Todd
3040,Reza Afra,Purdue,2015,Kinetics of polymer cyclization reaction and novel covalent DNA cross-linking assays,Brian Todd
3041,Amanda J. Hemphill,Purdue,2015,Development of experimental and instrumental systems to study biological systems,Brian Todd | Chittaranjan Das
3042,Michael Anderson,Rhode Island,2015,Development of new tools for study of the tumor microenvironment,Oleg Andreev | Yana Reshetnyak
3043,Ryan Lee Hayes,Rice,2015,Toward a simplified model of the RNA free energy landscape,Jose Onuchic
3044,Bobby Kim,Rice,2015,Optimization of predictive energy landscapes for membrane and globular protein structure prediction,Peter Wolynes
3045,Ha Huynh Truong,Rice,2015,Exploring the folding energy landscape,Peter Wolynes
3046,Tzu-Lin Sun,Rice,2015,Attack on single Escherichia coli spheroplast by antimicrobial peptides,Huey Huang
3047,Sithara Suransi Wijeratne,Rice,2015,Single molecule force signatures in biological physics,Ching-Hwa Kiang
3048,Asaminew H. Aytenfisu,Rochester,2015,Applying and improving the Amber RNA force field,David H. Mathews
3049,Jesse Marshall,Stanford,2015,Illuminated algorithms: expanding recordings of the neural code,Mark Schnitzer
3050,Gabriel Humphrey Billings,Stanford,2015,Measuring microbes: leveraging quantitative imaging to characterize heterogeneous systems across length scales,Kerwyn Huang
3051,Dmitry Pushkarev,Stanford,2015,Single-molecule whole genome reconstruction and haplotype phasing,Stephen Quake
3052,Cong Chen,Stony Brook,2015,Non-adiabatic dynamics of gene regulatory network,Jin Wang
3053,Xingbo Yang,Syracuse,2015,Collective phenomena in active systems,Cristina Marchetti
3054,Tao Zhang,Syracuse,2015,"Mechanics, shape, and programmability in soft matter systems: from fluid membranes to spring and droplet networks",Jennifer Schwarz
3055,Gulmammad Mammadov,Syracuse,2015,Measurement of the Membrane Electric Field and the Swimming Behavior of Chlamydomonas reinhardtii: Experiments and Analytical Modeling,Kenneth W. Foster
3056,Adolphe Kazadi Badiambile,Syracuse,2015,Modulation and interactions of charged biomimetic membrane with bivalent ions,Martin B. Forstner
3057,Ahmed Fouad,Temple,2015,Density-dependent diffusion models with biological applications,Edward Gawlinski | Theodore Burkhardt
3058,Amir Shahmoradi,Texas,2015,Dissecting the relationship between protein structure and sequence evolution,Swadesh Mahajan | Claus Wilke
3059,John Eric Widloski,Texas,2015,Grid cell attractor networks: development and implications,Ila Fiete
3060,Esma Eryilmaz,Texas A & M,2015,Comparative analysis of the self- and co-assembly of type-I and type-III collagend,Winfried Teizer
3061,Kamal Raj Dhakal,Texas Arlington,2015,"Laser-assisted transfection, optogenetic stimulation and its detection in mammalian cells",Samarendra Kumar Mohanty
3062,"Joseph Daniel Kimball, III",Texas Christian,2015,Porphyrin and bodipy molecular rotors as microviscometers,Zygmunt Gryczynski
3063,Marc Allen McWillliams,Texas Dallas,2015,Kinetics and charge transport through self-assembled DNA monolayers,Jason Slinker
3064,Hector Michael Belleza de Pedro,Texas Dallas,2015,Optical absorbance and fluorescence characteristics of burned rat skin,Robert Glosser
3065,James Parker,Texas San Antonio,2015,Investigating plausible mechanisms for the photo-induced partial unfolding of a globular protein,Lorenzo Brancaleon
3066,Brady McMicken,Texas San Antonio,2015,Photoinduced localized unfolding of tubulin heterodimers mediated by a water soluble porphyrin,Lorenzo Brancaleon
3067,Mohammed Junaid Farooqi,Texas San Antonio,2015,Photophysical characterization of perylene derivatives and their interaction with human serum albumin,Lorenzo Brancaleon
3068,Christopher L. Mimun,Texas San Antonio,2015,Rare earth based luminomagnetic nanoparticles and their applications in biomedical imaging,Dhiraj Sardar
3069,Sean M. Tanny,Toledo,2015,Investigation of radiation protection methodologies for radiation therapy shielding using Monte Carlo simulation and measurement,Ishmael Parsai
3070,Zifu Zhu,Tulane,2015,Light scattering study of polymer-colloid systems,Wayne Reed
3071,Colin A. McFaul,Tulane,2015,Fundamental interactions driving the coil-to-globule transition of poly(N-isopropylacrylamide) in water,Wayne Reed
3072,Laura Michele Innes,UC Irvine,2015,Nanopores and micropores as tools for biomimetics and biotechnology,Zuzanna Siwy
3073,Patrick Craig Sims,UC Irvine,2015,Single-molecule measurements of proteins using carbon nanotube field-effect transistors,Philip G. Collins
3074,Maxim V. Akhterov,UC Irvine,2015,Microsecond dynamics of enzymes: a single-molecule study using carbon nanotube transistors,Philip G. Collins
3075,Zahra Mashhadi Aghajan,UCLA,2015,Hippocampal activity in real and virtual environments,Mayank Mehta
3076,Amila Ariyaratne,UCLA,2015,Rheology of biological macromolecules,Giovanni Zocchi
3077,Craig Fogle,UCLA,2015,On mechanical transitions in biologically motivated soft matter systems,Joseph Rudnick
3078,David Ando,UC Merced,2015,Physical modeling of geometrically confined disordered protein assemblies,Ajay Gopinathan
3079,Chai Lor,UC Merced,2015,Phase behavior and nanotube formation in lipid membranes,Linda Hirst
3080,Ramsey N. Majzoub,UCSB,2015,Investigating intracellular pathways of surface-functionalized cationic lipid-DNA nanoparticles using quantitative fluorescence microscopy,Cyrus Safinya
3081,Yicong Ma,UCSD,2015,Structural studies of ternary mixture lipid multilayer systems and the effects of high hydration with x-ray diffraction,Sunil Sinha
3082,Cole David Chapman,UCSD,2015,The dynamics of entangled DNA networks using single-molecule methods,Douglas Smith
3083,Damian Jorge Deltoro,UCSD,2015,Single-molecule studies of DNA motor proteins,Douglas Smith
3084,Yaojun Zhang,UCSD,2015,Toward physical principles in biolgy,Olga Dudko
3085,Paul S. Henke,USC,2015,The effects of divalent counterions on the formation and stabilization of RNA tertiary structure,Chi Mak
3086,Benjamin Gross,USC,2015,From fuel cells to single cells: electrochemical measurements of electron transfer,Mohamed El-Naggar
3087,Ian McFarlane,USC,2015,Microbially synthesized chalcogenide nanostructures,Mohamed El-Naggar
3088,Sahand Pirhadian,USC,2015,Bacterial nanowires of Shewanella oneidensis MR-1,Mohamed El-Naggar
3089,Weili Hong,Utah,2015,Chemical and thermal modulation of molecular motor activities,Michael Vershinin
3090,Carl G. Ebeling,Utah,2015,Increasing estimation precision in localization microscopy,Jordan Gerton
3091,David Mashburn,Vanderbilt,2015,Mapping developmental mechanics in Drosophila melanogaster with force inference,Shane Hutson
3092,Sarah Michelle Crews,Vanderbilt,2015,Mechanics of Drosophila embryogenesis,Shane Hutson
3093,Hua Li,Vanderbilt,2015,Towards quantitative measurements of tissue microstructure using temporal diffusion spectroscopy,John Gore
3094,Ben Frederick Intoy,Virginia Tech,2015,"Pure and Mixed Strategies in cyclic competition: extinction, coexistence, and patterns",Michel Pleimling
3095,Shahir Mowlaei,Virginia Tech,2015,Mean field analysis of generalized cyclic competitions,Michael Pleimling
3096,Abhishek Mukhopadhyay,Virginia Tech,2015,Investigating the effect of charge hydration asymmetry and incorporating it into continuum solvation framework,Alexey V. Onufriev
3097,Xinyi Guo,Wake Forest,2015,Characterizing the micro-scale mechanical properties of hydrogels and cancer cells,Martin Guthold | Keith Bonin
3098,Wei Li,Wake Forest,2015,Single fibrin fiber mechanical properties and lysis,Martin Guthold
3099,Stephen Robert Baker,Wake Forest,2015,Determining single fiber properties using AFM,Martin Guthold
3100,Andrea Belanger,Wake Forest,2015,Biophysical studies aimed at potential therapies of hemoglobin associated diseases,Daniel Kim-Shapiro
3101,Rongzhong Li,Wake Forest,2015,"Molecular dynamic simulation of bio-molecular dynamics, folding and assembly",Samuel S. Cho
3102,Jie Liu,Wake Forest,2015,X-ray scatter computation and simulation in cone beam computed tomography,J. Daniel Bourland
3103,Jeffrey Pobst,Washington U,2015,Neural Processing in the Three Layer Turtle Visual Cortex,Ralf Wessel
3104,Thomas A. Crockett,Washington U,2015,Cortical Pyramidal Neuron subtype classification and visual response diversity,Ralf Wessel
3105,Leonid Shmuylovich,Washington U,2015,Kinematic modeling of the determinants of diastolic function,Sandor Kovacs
3106,Ruizhe Wang,Washington U,2015,"Force generation, polymerization dynamics and nucleation of actin filaments",Anders Carlsson
3107,Jonathan M. Kessler,Washington U,2015,From new method to intra-flagellar transport and photosynthesis – a single molecule investigation,Yan Mei Wang
3108,Anthony Paul Kovacs,Washington U,2015,Motor and cargo dynamics during intra-flagellar transport – a single molecule investigation,Yan Mei Wang
3109,Mahlega Hassanpour,Washington U,2015,Developing diffuse optical tomography for neuroimaging of speech perception for people with cochlear implants,Joseph Culver
3110,Koki Yokoi,UW – Milwaukee,2015,Theoretical investigation of interactions and relaxation in biological macromolecules,Valerica Raicu
3111,Jason Tenboer,UW – Milwaukee,2015,Time-resolved structural studies at the free electron laser,Marius Schmidt
3112,Peter Koo,Yale,2015,Novel optical-based methods and analyses for elucidating cellular mechanics and dynamics,Simon Mochrie
3113,Nathaniel Wolanyk,UAB,2016,"Temporal co-expression network construction, leading sub-network identification, and time point alignment in the integration of phase transition theory and systems biology and the application to human Type 1 diabetes",Xujing Wang
3114,Muhammad Asim Mubeen,Albany,2016,Bayesian signal detection and source separation in simulated brain computer interface systems,Kevin Knuth
3115,Golchehr Noshirvani Allahabadi,Arizona,2016,Bessel light sheet structured illumination microscope,Koen Visscher
3116,Yijun Ding,Arizona,2016,Charged particle emission tomography,Harrison Barrett
3117,David L. Dotson,Arizona State,2016,Solving the mechanism of Na/H Antiporters using MD simulations,Oliver Beckstein
3118,Jong One Im,Arizona State,2016,Electronic single molecule measurements with an STM,Stuart Lindsay
3119,Wayne B. Christenson,Arizona State,2016,Single cell force spectroscopy for quantification of cellular adhesion on surfaces,Robert Ros
3120,Brandon Mac Butler,Arizona State,2016,Protein conformational dynamics in genomic analysis,Banu Ozkan
3121,Joseph Michael Hardcastle,Boston University,2016,Studies of helicobacter pylori motility,Rama Bansil
3122,Carsten Madler,Boston University,2016,Silicon nanowire field-effect transistors for the detection of proteins,Shyamsunder Erramilli
3123,Timothy Harden,Brandeis,2016,Single molecule studies of bacterial RNA polymerase dynamics,Jane Kondev | Jeff Gelles
3124,Cong Qiao,Brandeis,2016,Simulations of curved assemblies in soft matter and biological systems,Michael Hagan
3125,Gabriel S. Redner,Brandeis,2016,Phase Transitions in Model Active Systems,Michael Hagan
3126,Stephen J. DeCamp,Brandeis,2016,Dynamics of active nematic liquid crystals,Zvonimir Dogic
3127,Achini Opathalage,Brandeis,2016,X-ray transparent microfluidics for protein crystallization  and biomineralization,Seth Fraden
3128,Michael Morse,Brown,2016,Motility of uni-flagellated bacteria,Jay X. Tang
3129,Lisa Bauer,Case Western,2016,Magnetic nanoparticles characterization for imaging and therapeutic applications,Mark Griswold
3130,Jaekyun Jeon,Central Florida,2016,Self-assembly of rous sarcoma virus capsid protein probed by solid state NMR and TEM,Bo Chen
3131,Aiqun Huang,Central Florida,2016,Conformations and dynamics of semi-flexible polymers,Aniket Bhattacharya
3132,Masoud Edalati,Cincinnati,2016,Diffusion tensor imaging application to cardiovascular MRI,Michael D. Taylor | Scott Holland
3133,Shima Dalirirad,Cincinnati,2016,Developing an aptamer-based biosensor for onsite detection of stress biomarkers in noninvasive biofluids,Andrew J. Steckl
3134,Ining Amy Jou,Clarkson,2016,Biomolecule sensing and filtering with tunable semiconductor membrane,Maria Gracheva
3135,Xin Wang,CMU,2016,Elasticity of lipid membrane leaflets: Determining pivotal plane and tilt modulus in computer simulations,Markus Deserno
3136,Robert C. Haussman,CMU,2016,Effective field theory of particle interactions mediated by fluid surfaces,Markus Deserno
3137,Patrick Diggins IV,CMU,2016,Investigation of Elastic Properties of Lipids and Proteins using Computer Simulations,Markus Deserno
3138,Marilia Barros,CMU,2016,Revealing the structural and molecular basis of retroviral assembly and endolysin PlyC membrane translocation using surface plasmon resonance and neutron reflectometry,Mathias Losche
3139,Robert Blackwell,Colorado,2016,Modeling cytoskeletal active matter systems,Matthew Glaser | Meredith Betterton
3140,Kevin Joseph Emmett,Columbia,2016,Topology of reticulate evolution,Raul Rabadan | Chris Wiggins
3141,Lucas Sawle,Denver,2016,Molecular mechanisms of protein thermal stability,Kingshuk Ghosh
3142,Neslihan Ucuncuoglu,Emory,2016,Influence of protein and solvent dynamics in ethanolamine ammonia lyase using time-resolved EPR and UV visible spectroscopy,Kurt Warncke
3143,Xinxian Shao,Emory,2016,Studies of bacterial population dynamics and antibiotic treatment,Ilya Nemanman
3144,Pramod Acharya,Florida Atlantic,2016,Charge regulation of a surface immersed in an electrolyte solution,Andy W.C. Lau
3145,Suraj Khanal,Florida Atlantic,2016,Improving the mechanical properties of nano-hydroxyapatite,Theodora Leventouri
3146,Casey Michael Curley,Florida Atlantic,2016,Phantom study incorporating a diode array into the treatment planning system for patient-specific quality assurance,Theodora Leventouri | Zoubir Ouhib
3147,Timothy Steckmann,Florida International,2016,Rate kinetics and molecular dynamics of the structural transitions in amyloidogenic proteins,Prem Chapagain | Bernard Gerstman
3148,Troy Warren Lowry,Florida State,2016,Nano-intaglio fabrication of optical lipid multilayer diffraction gratings with applications to biosensing,David van Winkle | Steven Lenhert
3149,F.N.U. Pavanjeet Kaur,Florida State,2016,Lipid-protein interactions defined by multi-frequency EPR,Likai Song
3150,Ling Wei,Florida State,2016,Experimental and computational studies on DNA electrophoresis in lyotropic polymer liquid crystals,David van Winkle
