,student_name,institution,year,dissertation_title,advisors
0,Frank Allen,Cornell,1902,Persistence of vision in color-blind subjects,Edward L. Nichols
1,Charles B. Bazzoni,Pennsylvania,1914,The destruction of bacteria through the action of light,Arthur W. Goodspeed
2,John Preston Minton,Chicago,1922,Sensitivity of normal and defective ears for tones of various frequencies,Robert Millikan
3,Vern Oliver Knudsen,Chicago,1922,Sensitivity of the ear to small differences of intensity and frequency,Robert Millikan
4,Frederick Williams Kranz,Chicago,1922,Sensitivity of the Human Ear as a Function of Pitch,Robert Millikan
5,Roger Moberly Morrow,Iowa,1927,Diffraction of x-rays in liquid monobasic fatty acids,George Walter Stewart
6,Paul Bellville Taylor,Pennsylvania,1927,Electromotive Force of the Cell with Transference and Theory of Interdiffusion of Electrolytes,Herbert Harned
7,"Ernst Albert Pohle, M.D.",Michigan,1928,Physical and biological investigations in the ultraviolet region of the mercury vapor spectrum,Ralph A. Sawyer
8,Dare Abernathy Wells,Cincinnati,1929,The Action of Low Velocity Electrons on Micro-organisms,unknown
9,Claude Richard Daum,Colorado,1934,The Electromotive Force of Polarization in the Human Body,unknown
10,Edward Pickels,Virginia,1935,The Air-Driven Ultra-Centrifuge,Jesse Beams
11,Franklin Seany Cooper,MIT,1936,Biologic Effects of Slow Electrons,Robley D. Evans
12,Fred Perrin,Rochester,1936,An Experimental Investigation of Binocular Vision,Brian O’Brien
13,Franklin Faller Offner,Chicago,1938,The recording of bioelectric potentials,Carl Eckart
14,Samuel Armstrong Talbot,Harvard,1938,Pupillography and the pupillary transient,unknown
15,Ernest William Landen,Missouri,1938,Sensitvity of Ustilago Zeae to ultraviolet light,Fred M. Uber
16,Alvin Martin Weinberg,Chicago,1939,Mathematical Foundations for a Theory of Biophysical Periodicity,Carl Eckart | Nicolas Rashevsky
17,Herman Russell Branson,Cincinnati,1939,The differential action of soft x-ray on Tubifex tubifex,Harold Kersten
18,David Gordon Sharp,Duke,1939,A study of certain effects of short ultraviolet rays on several species of bacteria,unknown
19,A. Alfred Erickson,Michigan,1939,Quantitative Spectrographic Determination of the normal lead content of certain biological materials,Ralph A. Sawyer
20,Otto Morningstar,MIT,1939,Apparatus for investigating the effects of cathode rays on biological material in vacuum,Robley D. Evans
21,Chung Kwai Lui,Oregon State,1941,The crystal photoeffect in D-tartaric acid single crystals,James J. Brady
22,Richard Peake Krebs,Cincinnati,1942,Applications of electronics to biophysics measurements,Harold J. Kersten
23,Frank Verbrugge,Missouri,1942,The inactivation of trypsin by ultraviolet radiation,Fred M. Uber
24,"Donald Bingham Wheeler, Jr.",Caltech,1947,Dispersion and absorption of ultra-high frequency EM waves in some fatty acids,unknown
25,Violet Marion Diller,Cincinnati,1947,Studies of a soft x-ray mutant of aspergillus niger van tieghem,Harold J. Kersten
26,Budd Roswell Russell,Wisconsin,1947,Physical methods of breaking down biological cells and tissues,Hugo B. Wahlin
27,John F. Schuler,Cincinnati,1949,A mass spectrometer for gaseous samples in biological research problems,Harold J. Kersten
28,Eugene Ackerman,Wisconsin,1949,Sonic Breakdown of Biological Cells,Hugo B. Wahlin
29,Harold N. Ritland,Wisconsin,1949,Small angle x-ray scattering from protein solutions,William W. Beeman
30,Marvin E. Wyman,Illinois,1950,Diffusion through a membrane,James Holley Bartlett
31,Gordon G. Wiseman,Kansas,1950,An ultraviolet microspectrophotometer: a device for the determination of nucleic acids in individual cell structures,unknown
32,Nisson A. Finkelstein,MIT,1950,The absorption and reflection of ultraviolet radiation by living human skin,unknown
33,Darwin L. Wood,Ohio State,1950,The infrared absorption spectrum of living muscle cells,Harald Nielsen | Ely Bell
34,Vernon F. Albert,Temple,1950,Analysis of Networks of Resonators and Their Application to the Production of Sound in the Vocal Tract,Claude S. McGinnis
35,Paul J. Kaesberg,Wisconsin,1950,The use of the double crystal spectrometer in the analysis of small angle scattering,William W. Beeman
36,Donald J. Fluke,Yale,1950,The Ultraviolet Inactivation Spectrum of T-1 Bacteriophage,Ernest C. Pollard
37,Roderick Keener Clayton,Caltech,1951,Studies in the Phototaxis of Rhodospirillum rubrum,Max Delbruck
38,Fred Ayres Blanchard,Cincinnati,1951,"Biophysical Interactions of x-rays, antibiotics, plant pathogens, and plants",Harold J. Kersten
39,Robert Augur Dudley,MIT,1951,The measurement of beta radiation dosage with photographic emulsions,Robley D. Evans
40,Marvin van Dilla,MIT,1951,The dosimetry of x- and gamma-rays with liquid-filled ion chambers,Robley D. Evans
41,Arthur Audley Evett,Washington Sate,1951,Reactions of some biologically significant substances to monomolecular surface films,Paul A. Anderson
42,Harold J. Morawitz,Yale,1951,The Ultraviolet Action and Mutation Spectra of Bacillus Subtilis,Ernest C. Pollard
43,William Gales Moulton,Illinois,1952,Mobilities of ion in collodion membranes,James Holley Bartlett
44,Robert Andrew Kromhout,Illinois,1952,Changes in the absorption bands of ethyl-cholorophyllide during crystallization,Eugene I. Rabinowitch
45,"Thomas Coleman Furnas, Jr.",MIT,1952,The development of focusing x-ray cameras for use of small diffraction angles and their application to the study of protein fibers.,Bertram Warren | Richard S. Bear
46,Richard E. Hartman,Pittsburgh,1952,The application of electrophoresis to identify biological activity in characteristic particles,Max Lauffer
47,Robert Arthur Wijsman,UC Berkeley,1952,Mathematical Theory of the Lethal Action of Radiation on Yeast Cells,Cornelius Tobias
48,Thomas B. Frazer,UCLA,1952,Selected Studies in Hearing by Bone Conduction,Norman Watson
49,John W. Anderegg,Wisconsin,1952,Small angle x-ray scattering from serum albumin solutions,William W. Beeman
50,Bowen R. Leonard,Wisconsin,1952,Small angle x-ray scattering from certain spherical viruses,William W. Beeman
51,Mark Wallon Jones,Florida,1953,Biophysical aspects of plant tissue cultures,Arthur Aaron Bless
52,Lee Palmer Stephenson,Illinois,1953,The kinetics of anodic films with an appendix on the Schlieren microscope,James Holley Bartlett
53,Theodore George Northrop,Iowa State,1953,Light Scattering by tobacco mosaic virus nucleic acid,Robert L. Sinsheimer
54,Howard Hunt Pattee,Stanford,1953,The compound reflection x-ray microscope,Paul Kirkpatrick
55,Edward Enslow Donaldson,Washington State,1953,Intracellular Studies with the Electron Microscope,unknown
56,Paul W. Schmidt,Wisconsin,1953,Small-Angle X-ray Scattering from Turnip-Yellow Mosaic Virus,William W. Beeman
57,George R. Hopkins,Iowa State,1954,Ultraviolet light scattering by tobacco mosaic virus nuclei acid,Robert L. Sinsheimer
58,William Lemoine Bade,Nebraska,1954,A study of specific interactions between macromolecules,Herbert Jehle
59,Philip Henri Cholet,Syracuse,1954,Investigations of Certain Frequency Dependent Electrical Properties of Biological Materials,Nathan Ginsburg
60,William Stanley Rothwell,Wisconsin,1954,Small-Angle X-ray Scattering from Protein Solutions,William W. Beeman
61,John Willliam McKee,Caltech,1955,Indole Inhibition of Cofactor Activated Bacteriophage.,Max Delbruck
62,"Frederick H. Giles, Jr.",Illinois,1955,Anodic Dissolution of copper in phosphoric acid,James Holley Bartlett
63,Edwin Lorenz Carstensen,Pennsylvania,1955,The acoustic properties of blood and its components,Herman P. Schwan
64,John W. Preiss,Yale,1955,"Absorption spectra of amino acids, peptides, nucleic acids and protein in the vacuum ultraviolet",Richard Setlow
65,Howard Williams Shields,Duke,1956,"Paramagnetic resonance of x-irradiated amino acids, fatty acids and proteins",Walter Gordy
66,Merle Kenneth Loken,Minnesota,1956,The effect of Roentgen rays on several biological systems,Samuel Schwartz
67,Jerrold Moore Yos,Nebraska,1956,A study of the specificity of the London-Van der Waals dispersion force in molecular aggregates,Herbert Jehle
68,Robert Lewis Berger,Penn State,1956,The Effect of Viscosity and Dielectric Constants on Hemoglobin and Catalase Reactions,Eugene Ackerman
69,Daniel M. Eckstein,Polytechnic Institute of Brooklyn,1956,Biological studies on stable and radioactive rare earth compounds,Kurt G. Stern
70,James Francis McGee,Stanford,1956,A long wavelength x-ray microscope,Paul Kirkpatrick
71,Rein Kilkson,Yale,1956,Radial electron distribution in cucumber virus number four,Franklin Hutchinson
72,Harvey N. Rexroad,Duke,1957,Paramagnetic resonance studies of free radicals produces by x-rays and by ultraviolet radiation,Walter Gordy
73,Ralph Sherman Cooper,Illinois,1957,Anodic behavior of copper in hydrochloric acid,James Holley Bartlett
74,Stanley Kingdon Derby,Michigan,1957,A program of analysis of biological material for metallic elements,Ralph A. Wolfe
75,Greenville Kash Strother,Penn State,1957,The Effect of Viscosity and Temperature on Catalase and Myoglobin Reactions,Eugene Ackerman
76,Mones Berman,Polytechnic Institute of Brooklyn,1957,The formulation of biological models from tracer and steady state data,Paul Ewald
77,Lawrence J. Katz,Polytechnic Institute of Brooklyn,1957,The crystal structure of N-methylacetamide,Isidore Fankuchen | Benjamin Post
78,Howard Ko,Purdue,1957,Genetic Fine Structure Studies of Minute Mutants of T4 Phage,Seymour Benzer
79,A.G. Malmon,Wisconsin,1957,"Small-Angle X-ray Scattering of the Size, Shape, and Hydration of Catalase",William W. Beeman
80,Phillip Herbert Geil,Wisconsin,1957,Application of small angle x-ray scattering to the determination of the structure of macromolecules,William W. Beeman
81,Benjamin S. Friesen,Iowa State,1958,Studies on the tobacco mosaic virus nuclei acid,Robert L. Sinsheimer
82,Robert Schor,Michigan,1958,Structure of fibrous proteins: feather keratin,Samuel Krimm
83,Leland Dwight Farringer,Ohio State,1958,NMR spectra of some amino acids,L. Carlton Brown
84,Cornelius T. Gaffey,Purdue,1958,The correlation between bioelectric changes and ion flows in chara,Lorin J. Mullins
85,Joseph John Higgins,Pennsylvania,1959,A theoretical study of the kinetic properties of sequential enzyme reactions,Britton Chance
86,"Gessner Harrison Echols, Jr.",Wisconsin,1959,An x-ray scattering study of protein denaturation,John W. Anderegg
87,Francis Joseph Jackson,Brown,1960,Sonically-induced microstreaming near a planar boundary,Wesley Nyborg
88,Francis Walter Patten,Duke,1960,Primary and secondary free radicals in irradiated biochemicals,Walter Gordy
89,Bruce Harold Van Domelen,Wisconsin,1960,A small angle x-ray study of two cylindrical viruses,John W. Anderegg
90,Robert Emmet Paul Smith,Brown,1961,An Investigation of Non-cavitational Destruction of Biological Materials,Wesley Nyborg
91,Russell Cooper Drew,Duke,1961,EPR resonance studies of gamma-irradiated polypeptides,Walter Gordy
92,"Erasmus Hardin Strickland, Jr.",Penn State,1961,Respiration and phosphorylation in heart and liver mitochondria isolated from altitude acclimatized rats,Eugene Ackerman | Adam Anthony
93,Raymond Patten,Duke,1962,ESR studies of irradiated proteins and nucleic acids,Walter Gordy
94,Irving Gilbert Post,Ohio State,1962,An electron paramagnetic resonance study of radiation damage in amino acids,L. Carlton Brown
95,O. Dayle Sittler,Penn State,1962,Factors Influencing Locomotor Activity Levels and Activity Rhythms in Intact and Decapitated Cockroaches,Eugene Ackerman | Thomas Smyth
96,James Edward Gill,Stanford,1962,"Thermoluminescence and EPR of amino acids, polypeptides and proteins irradiated with UV light",Mitchel Weissbluth
97,"Joseph Howe Hadley, Jr.",Duke,1963,ESR studies of irradiated biological sulphur compounds,Walter Gordy
98,Evelyn Fox,Harvard,1963,Photoinactivation and Expression of Genetic Information in Bacteriophage Lambda,Matthew Meselson
99,Adolf Eric Smith,Michigan State,1963,A Search for Biological Effects of Magnetic Fields,David J. Montgomery
100,Leo Gross,NYU,1963,A study of the biological effects of magnetic fields,Alexander Sandow | Norman Molomut
101,Jimmie C. Oates,Vanderbilt,1963,The acoustic properties of aqueous solutions of RNA and DNA,Robert Lagemann
102,Alexander Mallory Clarke,Virginia,1963,A magnetic balance for the determination of densities and partial specific volumes,Jesse Beams
103,Richard Arnold White,Wisconsin,1963,A small angle x-ray scattering investigation of broad bean mottle virus,John W. Anderegg
104,Wallace Clayton Snipes,Duke,1964,Free radicals and paramagnetic ions in biological systems,Walter Gordy
105,Wade Jett Temple,West Virginia,1964,Absorption and magnetic resonance spectroscopy of free radicals at microwave frequencies,Harvey Rexroad
106,Clyde Bratton,Western Reserve University,1964,NMR studies of living muscle,Joseph W. Weinberg
107,Dale Vernon Ulrich,Virginia,1964,The Partial Specific Volume of Proteins,Jesse Beams
108,Faustin Neff Weber,Virginia,1964,Sedimentation Diffusion Equilibrium Studies of Viruses,Jesse Beams
109,Thomas Henry Moss,Cornell,1965,Mossbauer spectroscopy of iron proteins,Alan J. Bearden
110,Paul Francis Mullaney,Delaware,1965,The effect of damaged proteins on the light scattering properties of ribonucleic acid solutions,John W. Preiss
111,Brenda Lamont Pruden,Duke,1965,ESR studies of irradiated nucleic acids and constituents of nucleic acids,Walter Gordy
112,Robert Earle Krisch,Pennsylvania,1965,Effects of radioactive phosphorus decay on genetic recombination in Escherichia coli K-12,Thomas Wood
113,Eric Hans Ellis,Syracuse,1965,The Fluorescence of Bone,Charles H. Bachman
114,Dale Lewis Mordue,Texas A&M,1965,Spectral sensitivity of the compound eye of the boll weevil using the electroretinogram,O. Dayle Sittler
115,Fritz Albert Fischbach,Wisconsin,1965,An X-ray Scattering Study of Ferritin and the Bacteriophage R17,John W. Anderegg
116,Zoltan Geza Sztankay,Wisconsin,1965,An X-ray Scattering Study of Myoglobin in Solution,John W. Anderegg
117,"Roderick McLellan Grant, Jr.",Wisconsin,1965,"The effects of pre-irradiation annealing on the thermoluminescence, dielectric loss, and optical absorption of LiF:Mg",John R. Cameron
118,Narendra S. Goel,Maryland,1966,Denaturation and renaturation of the DNA molecule,Elliot Montroll
119,Robert Milton Pearlstein,Maryland,1966,Migration and trapping of excitation quanta in photosynthetic units,Elliot Montroll
120,John Talley Winthrop,Michigan,1966,"The formation of diffraction images: Fresnel images, the compound eye, and holographic microscopy",C. Roy Worthington
121,Eberhard Erich Fetz,MIT,1966,Pyradmidal tract effects on spinal cord interneurons,Patrick D. Wall
122,Sigfrid Strassler,UC Berkeley,1966,On the melting transition in high-molecular weight DNA,Charles Kittel
123,Lloyd W. Johston,Vanderbilt,1966,Bioelectric potentials in skin burns and x-ray erythemas,Otto Blüh
124,Karl J. Youtsey,Illinois Tech,1967,Optical excitation of the eosin-human serum albumin complex,Leonard Grossweiner
125,"Jesse James Butts, Jr.",Kansas State,1967,Width of ion and monopole tracks in emulsion and radiation damage by heavy ions in enzymes and viruses,Robert Katz
126,Allen Edward Blaurock,Michigan,1967,X-ray diffraction studies of the myelin sheath of nerve,C. Roy Worthington
127,Michael Myron Malley,UCSD,1967,The Zeeman and Stark effects in porphyrin,George Feher
128,"Leon Neely Beard, Jr.",Vanderbilt,1967,"The crystal structure of calcium 1,3-diphosporylimidazole",Paul Lenhert
129,John D. Thompson,Wisconsin,1967,An x-ray scattering investigation of Escherichia Coli,John W. Anderegg
130,Walter E. Hill,Wisconsin,1967,A small angle x-ray scattering study of ribosomal particles from Escherichia Coli,John W. Anderegg
131,James Lake,Wisconsin,1967,A small angle x-ray scattering study of transfer-RNA from yeast,William Beeman
132,Farnsworth Dudley Bryant,Auburn,1968,Total Light Scattering by Large Biological Particles,Paul Latimer
133,Thomas G. Ebrey,Chicago,1968,Fast Light-Evoked Potentials in Biological Tissues,John Rader Platt
134,"Chester Alexander, Jr.",Duke,1968,ESR studies of radiation damage to single crystals of guanine hydrochloride,Walter Gordy
135,"Franklin Glenn Liming, Jr.",Duke,1968,ESR studies of free radicals formed in polyamino acids by reaction with H atoms,Walter Gordy
136,John Dow,Rochester,1968,Resonance energy transfer in condensed matter from a many-particle point of view,Robert Knox
137,Andrew Anthony Marino,Syracuse,1968,Dielectric and paramagnetic resonance properties of bone,Charles H. Bachman
138,Stanley Bram,Syracuse,1968,A Study of the structure of nucleohistone and DNA,William Beeman
139,James Ewbank Hall,UC Riverside,1968,The electrical conductivity of AgBr membranes and diffuse double layer theory,Leon J. Bruner
140,Richard Eugene Johnston,Vanderbilt,1968,Physical problems inherent in quantitative in-vivo dosimetry of radiopharmaceuticals,Bertrand Brill
141,Paul Farrell Fahey,Virginia,1968,Pressure dependence of specific volumes for biomacromolecules,Jesse Beams
142,Stanley Bram,Wisconsin,1968,A study of the structure of nucleohistone and DNA,William W. Beeman
143,David Mantik,Wisconsin,1968,An x-ray scattering study of hydration of proteins,unknown
144,Harvey Benjamin Haukaas,Connecticut,1969,A Monte Carlo simulation of the alpha-beta transformation in keratins,Robert Schor
145,Eric Gunnar Jakobsson,Dartmouth,1969,Calcium control of nervous excitation,Joseph Harris
146,James Joseph Lichter,Duke,1969,ESR studies of radiation damage to a single crystal of deoxyadenosine monohydrate,Walter Gordy
147,Richard Anthony Lorey,Georgia Tech,1969,Ferroelectricity of the nucleic acids and selected nucleotides and poly-ribonucleotides,Augustus Stanford
148,Arthur Roger Cooke,Illinois,1969,Mössbauer studies of putidaredoxin,Hans Frauenfelder
149,Leepo Cheng Yu,Maryland,1969,Theory of denaturation of copolymeric DNA,Elliot Montroll
150,William John Gras,Michigan,1969,Vertebrate retinal photoreceptor ultra-structure analysis using low-angle x-ray diffraction techniques,C. Roy Worthington
151,Paul John Harget,Michigan,1969,Low-angle equatorial x-ray analysis of fibrous systems with application to the keratins,Samuel Krimm
152,Jack William Taylor,Michigan,1969,The fast-photovoltage and electroretinogram of the frog eye,John R. Platt
153,Alvin Stuart Konigsberg,Syracuse,1969,A Study of the measurement of ozone and some effects of ozone and nitrogen oxides on the activity of rats,Charles H. Bachman
154,Joseph Anthony Spadaro,Syracuse,1969,Trace metal ions in bone and collagen,Charles H. Bachman
155,Gerald Entine,UC Berkeley,1969,Physical probes of nerve membrane structure,Melvin Calvin
156,Roderick B. Davidson,Alabama,1970,Quantum tunneling and its effect on the ESR absorption in an irradiated crystal,Ichiro Miyagawa
157,Jack Denney Griffith,Caltech,1970,High resolution electron microscope studies of chromosomal fibers,James Frederick Bonner
158,Barbara Ann Cernansky,Florida State,1970,The ESR of deuterated DL-tartaric Acid single crystals irradiated at low temperatures,Grace C. Moulton
159,William Turlay Stacy,Illinois,1970,Delayed fluorescence as a probe of radiationless transitions in anthracene and algae,John J. Gilman
160,Alan George Kepka,Illinois Tech,1970,The investigation of primary photochemical processes in the eosin-human serum albumin complex,Leonard Grossweiner
161,Edward Will Ronish,Michigan,1970,The circular dichroism of helical polypeptide structure,Samuel Krimm
162,Stuart Brian Dubin,MIT,1970,Quasielastic light scattering from macromolecules,George Benedek
163,Marvin Lawrence Chatkoff,New Mexico,1970,MO calculations to determine stable conformations of the nucleotide deoxycytidine,Charles L. Beckel
164,Richard Allan Harper,NYU,1970,An x-ray scattering study of insulin,Aaron Posner
165,Charles Peter Delisi,NYU,1970,Thermally induced transitions in collagen,Morris Shamos
166,Jong Jin Lim,NYU,1970,An investigation of the bound water in tendon by dielectric measurements,Morris Shamos
167,Andres Manring,Ohio State,1970,The staircase phenomenon in guinea pig left atria: a calcium exchange model,Philip B. Hollander
168,Joe Stanley Crane,Oklahoma State,1970,The dielectrophoresis of cells,Herbert Pohl
169,Mien Wann,Pennsylvania,1970,Modification of genetic recombination In Escherichia coli by radiations and metabolic inhibitors,Thomas Wood
170,Demetrios Hademenos,Syracuse,1970,Production of air ions and ozone by barley tips under electric fields,Charles H. Bachman
171,James McElroy,UCSD,1970,On the nature of the light-induced free radical observed in photosynthetic bacteria,George Feher
172,James Rooney,Vermont,1970,Hemolysis with ultrasonically induced stable cavitation,Wesley Nyborg
173,Joe Harris McGee,Virginia,1970,The constant speed magnetic ultracentrifuge,Jesse Beams
174,Dan Allan Cross,Auburn,1971,Theory of light scattering by cylindrical particles and observed large angle scattering by biological cells,Paul Latimer
175,Jesse L. Cude,Colorado,1971,"1D, 2D, and 3D systems: specific heat measurements on poly (L-alanine)",Leonard Finegold
176,Paul Hershel Swerdlow,Columbia,1971,Mossbauer Studies of Sickle Cell Hemoglobin,Chien-Shiung Wu
177,Stephen Craig Harvey,Dartmouth,1971,The state of surface bound water on lysozyme,Pieter Hoekstra
178,Dennis A. Stevenson,Delaware,1971,The influence of temperature on globular protein-polyribonucleotide interactions,John W. Preiss
179,Keith Westcott Reiss,Duke,1971,ESR studies of radical pairs in carbazide and of nucleoside base radicals in 5-chlorouridine,Walter Gordy
180,Ademola Amusa,Illinois,1971,Mossbauer studies of nuclear hyperfine interactions in hemin and bisimidazole hemin,Peter Debrunner
181,Warren Herbert Woolley,Maryland,1971,Theoretical Studies of Asynchrony in Cell Colonies,Andrew G. De Rocco
182,Thomas William Houk,Maryland,1971,A stochastic model for the contractile process  in vertebrate striated muscle,Andrew G. De Rocco
183,"Glen Isaac King, Jr.",Michigan,1971,Low-angle x-ray diffraction studies of nerve myelin sheath,C. Roy Worthington
184,Subhash Chandler Sharma,Nebraska,1971,"Track effects in physical, chemical, and biological systems",Robert Katz
185,Mehdi Homayoonfar,Nebraska,1971,Application of track structure theory to dosimetry and radiobiology,Robert Katz
186,Robert Ter Bush,Northwestern,1971,Statistical mechanical models for hemoglobin and allosteric enzymes,Colin J. Thompson
187,Suresh Kumar Mahajan,Pennsylvania,1971,Negative interference in Escherichia coli and its bearing on the mechanisms of genetic recombination,Thomas Wood
188,David Andrew Superdock,Penn State,1971,In situ microspectrophotometric determination of screening pigment absorption spectra of Drosophia Melanogaster eye-color mutants,Greenville Strother
189,Vincent P. Tomaselli,NYU,1971,Hydration-dependent electrical properties of solid state collagen,Morris Shamos
190,Roger Wartell,Rochester,1971,The equilibrium helix coil transition of DNA,Elliot Montroll
191,James Watts,Vanderbilt,1971,Methods for quantitative assay of radioactivity in man,Bertrand Brill
192,James Dehihns Bond,Virginia Polytechnic,1971,The dipole model and cooperative behavior in excitable membranes,Richard Arndt | David Roper
193,Mindaugas Paul Labanauskas,Wisconsin,1971,X-ray studies of the 3D structure of transfer RNA,William W. Beeman
194,Peter Gioia Connors,Wisconsin,1971,X-ray structural studies of transfer RNA and 5S ribosomal RNA,William W. Beeman
195,Don Allen Hampton,Alabama,1972,ENDOR and ESR Studies of irradiated cytidine,Chester Alexander |  Jr.
196,Estelle A. Friday,Alabama,1972,Search for a trapped-hole in an L-alanine crystal irradiated at liquid nitrogen temperature,Ichiro Miyagawa
197,Michael S. Isaacson,Chicago,1972,"The interaction of 25 Kev electrons with the nucleic acid bases, adenine, thymine and uracil",Albert V. Crewe
198,Dale E. Johnson,Chicago,1972,The interaction of 25 keV electrons with guanine and cytosine,Albert V. Crewe
199,Bruce W. Castleman,Florida State,1972,The ESR and ENDOR of single crystals of DL-serine,Grace C. Moulton
200,"Paul Elias Mackie, Jr.",Georgia Tech,1972,Precision singe-crystal x-ray diffractometry,Raymond Young
201,Albert Brunsting,New Mexico,1972,Light Scattering from Mammalian Cells,Paul F. Mullaney
202,Jane C. Chang,Rochester,1972,Electronic excitation interaction between large molecules: application to chlorophylls.,Robert Knox
203,John Robert Clay,Rochester,1972,Models for Firing of a Neuron,unknown
204,Ronnie Jack Hastings,Rochester,1972,Electronic assimilation of radiation imagery data,John A. McIntyre
205,Richard A. Haak,Southern Illinois,1972,ESR studies of radiation damage in substituted pyrimidines,Brent Benson
206,James Allen Patton,Vanderbilt,1972,New approaches to imaging of distributions of stable and radioactive tracers within the body,Bertrand Brill
207,Norman C. Dyer,Vanderbilt,1972,Human fetal radiation dose from Fe-59 administered to the mother during pregnancy,Bertrand Brill
208,Jon Jay Erickson,Vanderbilt,1972,Applications of computers and digital techniques in clinical and investigative medicine,Bertrand Brill
209,Martin Garry Hodgins,Virginia,1972,A Magnetic Densimeter-viscometer,Jesse Beams
210,Donald Lee Allison,Alabama,1973,ESR and ENDOR studies of irradiated guanine and cytidine,Chester Alexander |  Jr.
211,David Sugarman,CCNY,1973,Diffusion-Interaction Phenomena in Biochemical Systems,Hiram Hart
212,Thomas McIntosh,CMU,1973,X-ray diffraction studies of the nerve myelin sheath,C. Roy Worhtington
213,Dennis E. Koppel,Columbia,1973,The study of biological macromolecules by intensity fluctuation spectroscopy of scattered laser light: the ribosomes of Escherichia coli,Seymour H. Koenig
214,David Charles Straw,Florida State,1973,The ESR of irradiated single crystals of succinamic acid,Grace C. Moulton
215,Thomas Michael Corwin,Georgia Tech,1973,Experimental evidence for a physiological model of memory and learning,Augustus Stanford
