,student_name,institution,year,dissertation_title,advisors
843,Robert Thomas Engelhardt,Duke,1995,Alternative contrast mechanisms in high-field magnetic resonance microscopy,G. Allan Johnson
844,Jorge H. Rodriguez,Illinois,1995,Mossbauer studies of spin-coupled binuclear iron centers in proteins,Peter Debrunner
845,Dong Xu,Illinois,1995,Molecular dynamics studies of proteins under perturbations,Klaus Schulten
846,Kelvin Chu,Illinois,1995,Structural heterogeneity and conformal relaxation in heme proteins,Hans Frauenfelder
847,David Henry Ehrenstein,Illinois,1995,Dynamics of blue copper proteins,Hans Frauenfelder
848,Keith Michael Berland,Illinois,1995,Two-photon fluctuation correlation spectroscopy: method and applications to protein aggregation and intracellular diffusion,Enrico Gratton
849,Oh’d-Ali Al-Akhras,Illinois Tech,1995,Photosensitization of red blood cell photohemolysis,Leonard Grossweiner
850,Harry Hong Gao,Massachusetts – Lowell,1995,Investigation of optical properties of biomolecular materials for developing a novel fiber optic biosensor,Jayant Kumar | Sukant Tripathy
851,Kevin Hunter Knuth,Minnesota,1995,Dynamics of the human auditory cortex in response to periodic auditory stimuli,John Broadhurst
852,Canwen Liu,MIT,1995,Phase separation in multicomponent protein-water solution,George Benedek
853,Henry George Thomas,MIT,1995,Phase transitions and micellar size distributions in ternary surfactant systems,George Benedek
854,Dawn C. Faruggio,MIT,1995,Structure-function relationships of human initiator tRNA mutants,Uttam L. RajBhandary
855,Vijay S. Pande,MIT,1995,Freezing transition of heteropolymers,Toyoichi Tanaka
856,Wei Dong Tian,Northeastern,1995,"Temperature, pH and viscosity dependent kinetics and dynamics of heme proteins",Paul Champion
857,Carlos Emilio Galindo,Northeastern,1995,Modeling of interacting molecules in solution using the potential of mean force,Jeffrey Sokoloff
858,Ronald Albright,Oregon,1995,Structural studies of the interaction of Cro protein from phage lambda with DNA,Brian W. Matthews
859,Thomas Powers,Pennsylvania,1995,Fluctuating bilayer membranes,Philip Nelson
860,Weicheng Cai,Pennsylvania,1995,Hydrodynamics of fluid membranes,Thomas Lubensky
861,Leping Zha,Pittsburgh,1995,Improvements in techniques of ultrafast NMR imaging,Irving J. Lowe
862,Sarah Lynn Keller,Princeton,1995,Voltage clamp and x-ray diffraction studies of alamethicin,Sol Gruner
863,Luc Pierre Faucheux,Princeton,1995,Forces in the Brownian World,Albert Libchaber
864,Deborah Fygenson,Princeton,1995,Microtubules: the rhythm of assembly and the evolution of form,Albert Libchaber
865,Michael Robert DeWeese,Princeton,1995,Optimization principles for the neural code,William Bialek
866,Hung Duc Cao,Rice,1995,Protein dynamics at various hydration levels using incoherent quasielastic neutron scattering,Huey Huang
867,Kevin R. Minard,Rice,1995,Spectral analysis of molecular diffusion in heterogeneous systems using pulsed gradient NMR,Harold E. Rorschach
868,Xiaodong Zhang,Stony Brook,1995,Development and application of quantitative x-ray microscopy with chemical sensitivity,Janos Kirz
869,Richard Brian Gross,Syracuse,1995,"The development, characterization and applications of polymeric films containing bacteriorhodopsin",Robert R. Birge
870,Youcef Fezoui,Tufts,1995,De novo design of an alpha-helical hairpin peptide,David Weaver
871,William Schneller,Tufts,1995,Computer models of helix-coil transitions,David Weaver
872,Kirk Montgomery Palmer,UCSB,1995,The role of thermal fluctuations in two surfactant systems,Philip Pincus
873,Hyoungsoo Yoon,UCSC,1995,Dynamics of entangled polymers at interfaces,Joshua Deutsch
874,Jeffrey Regan,UCSD,1995,Electron Tunneling in Proteins,Jose Onuchic
875,Marcos Ruben Betancourt,UCSD,1995,Protein Folding Dynamics,Jose Onuchic
876,Vitor B. Pereira Leite,UCSD,1995,Structure and dynamics of solvent landscapes in charge-transfer reactions,Jose Onuchic
877,Philip Michael Kiefer,UCSD,1995,Mechanistic studies of short-chain dihydropteridine reductase,Nguyen-Huu Xuong
878,Leonard Alan Bradshaw,Vanderbilt,1995,Measurement and Modeling of Gastrointestinal Bioelectric and Biomagnetic Fields,John Wikswo
879,John Andrew Kozub,Vanderbilt,1995,Photocrosslinking and photodamage in protein-nucleic acid systems,Glenn Edwards
880,YanJun Zhang,Washington,1995,XAFS research on biological systems,Edward Stern
881,Brentley Keith Hoffmeister,Washington U,1995,Ultrasonic characterization of the linear elastic properties of myocardium and other soft tissues,James G. Miller
882,Da-Guang Xu,UAB,1996,Sequence-dependent energy transfer in DNA oligonucleotides,Thomas Nordlund
883,Mingda She,UAB,1996,Calcium-induced conformational changes in troponin C from skeletal muscle,Herbert C. Cheung
884,Kunbin Qu,Albany,1996,Dielectric resonator and its application in protein folding,Charles P. Scholes
885,Vibha Dattaji Rao,Albany,1996,Structure and function of endo-beta-N-acetylglucosaminidase,Patrick Van Roey
886,Sangeetha B. Rao,Albany,1996,Thermal denaturation of tissues: quantification using MRI,John Schenck
887,Dimitry Rekesh,Arizona State,1996,An investigation of the potential of Scanning Tunneling Microscopy for sequencing of DNA,Stuart Lindsay
888,James Patrick Lewis,Arizona State,1996,Quantum molecular dynamics of large biological systems,Otto Sankey
889,Nobel Sanjay Rebello,Brown,1996,Modeling and Experiments on Tunneling in Floating-Gate Memory Cells With Applications in Electronic Artificial Neural Networks,Hendrik Gerritsen
890,Song Lai,Case Western,1996,Brain functional MRI using blood as an endogenous contrast agent,Robert W. Bown | Mark Haacke
891,William D. Carter III,Central Florida,1996,Raman spectroscopic study of single red blood cells infected by malaria,Alfons Schulte
892,Sandra Larson,Clemson,1996,Long-range effects of localized radiation damage in DNA,Lyndon Larcom
893,Wenjun Sun,CMU,1996,X-ray structural investigations of chain ordered lipid bilayers,John Nagle
894,Zhen-Yu Sun,CMU,1996,A biophysical investigation of the structure and kinetics of the membrane-associated D-lactate dehydrogenase from Escherichia coli,Chien Ho
895,Brent Howard Bailey,CMU,1996,Enhancement of axial resolution in fluorescence microscopy by standing wave excitaton,Frank Lanni
896,Shujun Ding,Dartmouth,1996,Diffusion-weighted MRI with high gradient fields,Harold Swartz
897,Steven Glen Lloyd,Emory,1996,Physical studies of ferrochelatase and ferritin,Boi Hanh Huynh
898,Guofeng Yin,Emory,1996,Quantitative brain SPECT with fan beam collimation,James R. Galt
899,Hengli Henry Li,Emory,1996,Comparison of SNR in 2D and 3D PET neuro-activation studies,John R. Votaw
900,William Allison Hercules,Howard,1996,Electroporation of biological cells embedded in a polycarbonate filter,Anna Coble
901,Svilen Svetorzarov Tzonev,Illinois,1996,Morphogenesis of the lateral geniculate nucleus in primates,Klaus Schulten
902,William Fowler Humphrey,Illinois,1996,Molecular dynamics studies of the protein baceteriorhodopsin,Klaus Schulten
903,Todd Eugene French,Illinois,1996,The development of fluorescence lifetime imaging and an application in immunology,Enrico Gratton
904,Marwan Alfahhad,Illinois Tech,1996,Field deployable methods for the characterization of encapsulated hemoglobin,Leonard Grossweiner
905,Lingyang Zhu,Indiana/Purdue,1996,Characterizing internal motions of peptides and proteins by NMR specroscopy,Marvin Kemple
906,Scott David Wollenweber,Iowa,1996,Measurement of the arterial time-activity curve in water PET,Richard Hichwa
907,John Richard Rahn,Massachusetts,1996,Adsorption of macromolecule onto functionalized surfaces,Robert Hallock
908,Anne Gershenson,Michigan,1996,Time-resolved optical methods for the study of protein folding and conformation,Duncan Steel | Ari Gafni
909,Keith Thomas Olree,Mississippi,1996,Spatial dependence of the performance of active noise reduction earplugs,F. Douglas Shields
910,Scott Dynes,MIT,1996,Discharge characteristics of auditory nerve fibers,George Benedek
911,Jyostna Pendyala,Montana State,1996,Chemical effects of biofilm colonization on stainless steel,Recep Avci
912,Hassan Ahmad Alkhatib,North Dakota,1996,Environmental radon decay products in neurological diseased and non-diseased brains and brains of cigarette smokers,Glenn Lykken
913,Michael Mohr Clark,Oklahoma State,1996,Computational studies of complex systems,H. Larry Scott
914,Hongjun Zhou,Oregon,1996,NMR studies of domain fragments of the histidine autokinase CheA from Escherichia Coli,Brian Dahlquist
915,Jian Xu,Oregon,1996,"Structural and thermodynamics analysis of the hydrophobic effect, core packing, and internal water molecules in T4 lysozyme",Brian W. Matthews
916,Maureen Ann O’Leary,Pennsylvania,1996,Imaging with diffuse photon density waves,Arjun Yodh | Britton Chance
917,David Alan Boas,Pennsylvania,1996,Diffuse photon probes of structural and dynamical properties of turbid media: theory and biomedical applications,Arjun Yodh
918,Yong Duan,Pittsburgh,1996,Dynamics of DNA and its interactions with proteins: a statistical mechanical study,John M. Rosenberg
919,David Paul Madio,Pittsburgh,1996,Improvements in ultrafast MRI with application to flow,Irving J. Lowe
920,Anthony Charles Zable,Portland State,1996,Redox control of the calcium release channel from skeletal muscle sarcoplasmic reticulum,Jonathan Abramson
921,William Charles Brown,Portland State,1996,Mechanisms of pentachlorophenol-induced charge transport in lipid membranes,Arnold Pickar | Pavel Smejtek
922,Paul Ellsworth Harper,Princeton,1996,Structural studies of surfactant and polymer systems,Sol Gruner
923,Michael E. Wall,Princeton,1996,Diffuse features in x-ray diffraction from protein crystals,Sol Gruner
924,Fredrik Hans Oskar Osterberg,Princeton,1996,Induced changes in the diffuse x-ray scattering background from protein crystals,Sol Gruner
925,Ke He,Rice,1996,Studies of amphiphilic helical peptides interacting with lipid bilayer membranes,Huey Huang
926,Willliam Heller,Rice,1996,A comparative study of the membrane active beta sheet peptide protegrin with the alpha-helical peptide alamethicin,Huey Huang
927,Steven Jay Ludtke,Rice,1996,Structural studies of membrane lytic peptides,Huey Huang
928,Michael Nichols,Rochester,1996,Transport of oxygen and light in model tumor systems,Thomas Foster
929,Krishnan Kumaran,Rutgers,1996,Statistical physics of perception,Davi Geiger
930,Matteo Pellegrini,Stanford,1996,Efficient computational techniques to model solute-solute interactions in biomolecular simulations,Seb Doniach
931,Thomas Glen Graeber,Stanford,1996,Hypoxia-mediated tumor development,Amato Giaccia
932,Ge Zhang,Tennessee,1996,Heat capacity of solid state proteins by thermal analysis,Bernhard Wunderlich
933,Rohit Pappu,Tufts,1996,Algorithms for modeling interactions and folding pathways in proteins,David Weaver
934,Taekjip Ha,UC Berkeley,1996,Fluorescence spectroscopy of single molecules at room temperature and its applications,Daniel Chemla
935,James Lincoln Aroyan,UC Santa Cruz,1996,3D numerical simulation of biosonar signal emission and reception in the common dolphin,Geoffrey Vallis
936,Jerr Ann Tribble,Vanderbilt,1996,Role of wavelength and pulse structure in the ablation of tissue and gelatin,Glenn Edwards
937,Bertha Katrina Wagner,Vanderbilt,1996,Analytical model for the electrostatic potentials around dissolve DNA,Glenn Edwards
938,David Matthew Gregory,Washington,1996,The Design of New Solid-State NMR Experiments for Use in Determining Oligonucleotide Structure,Gary P. Drobny
939,Erbil Akbudak,Washington U,1996,Gadolinium-enhanced magnetic resonance phase contrast in measuring arterial input functions for perfusion imaging,Richard E. Norberg | Thomas Conturo
940,Lei Wang,Albany,1997,Polycapillary optics for hard x-rays,Carolyn McDonald
941,Scott Matthew Owens,Albany,1997,Development of polycapillary x-ray optics for macromolecular crystallography,Walter Gibson
942,Ove Lyngnes,Arizona,1997,Optical properties of semiconductor nanostructures and photoactive yellow protein,Hyatt Gibbs
943,Yin Wang,Arizona,1997,Influence of membrane biophysical properties on the Metarhodopsin I to Metarhodopsin II transition,Daniel Stein | Michael F. Brown
944,Matthew Coleman,Boston University,1997,The role of specific amino acid residues in the pump mechanism of bacteriorhodopsin,Ken Rothschild
945,Gandhi Viswanathan,Boston University,1997,Analysis of Anomalous Fluctuations in the Dynamics of Complex Biophysical Systems,H. Eugene Stanley
946,Xingxiang Chao,Boston University,1997,Aggregation and gelation of mucin,Rama Bansil
947,Bin Yu,Brandeis,1997,X-ray studies of disordered structures in protein crystals,Donald Caspar
948,Juanhui Xie,Brandeis,1997,Characterization of a prototype CCD-based detector for digital mammography,Walter Phillips | Marty Stanton
949,Michael Robert Thompson,Case Western,1997,Optimization utilizing inverse methods for the design of MRI systems,Robert W. Brown
950,Valeska L.M. Scharen-Guivel,Catholic University,1997,Detection and imaging of proton chemical exchange in biological tissue using NMR,Robert S. Balaban | Steven D. Wolff
951,Zhongmo Ju,CCNY,1997,Pre-resonance Raman spectroscopic studies of retinoid binding proteins,Robert Callender
952,Joel Hernandez,CCNY,1997,Experimental study hydrogen bond interactions in helical peptides,Robert Callender
953,Guang Bai,CCNY,1997,Ultrafast spectroscopy in biological materials,Robert Alfano
954,Vincent Jerome Schmithorst,Cincinnati,1997,Noise properties of a dual-energy imaging kinestatic charge detector,Robert Endorf
955,Dazhen Philip Sun,CMU,1997,"Biophysical and Biochemical Studies of Structure-Function Relationships in Human Normal Adult, Recombinant Mutant, and Chemically Modified Hemoglobins",Chien Ho |  Biology
956,Thomas Andrew Winningham,Colorado,1997,Massively parallel nanofabrication using biologically derived masks,Kenneth Douglas
957,Dan Liao,Drexel,1997,Kinetic Micromethod for Measuring the Solubility of Native and Mutant Sickle Hemoglobin,Frank Ferrone
958,Shuxian Chen,Emory,1997,Mechanism of oxygen activation by the diferrous R2 of eschereschi coli ribonucleotide reductase,Boi Hanh Huynh
959,Lisong Liu,Emory,1997,A Comprehensive method for quantitative cardiac SPECT,James Cullom
960,Wenhua X. Ni,Florida,1997,Design of novel RF coils for signal-to-noise improvement in NMR,Thomas Mareci
961,Andrew Burton Feldman,Harvard,1997,Spiral waves in a discrete model of excitable media,Richard Wilson
962,Stelios Manolis Smirnakis,Harvard,1997,Neural Coding Can Make Use of Higher Order Statistics in the Visual Ensemble,Sidney Coleman | Alan Yuille
963,John Stewart Maier,Illinois,1997,Diffuse photon transport in tissue-like media: Resolution limit for near-infrared imaging and an instrument for clinical spectroscopy of tissues,Enrico Gratton
964,Benjamin Hamilton McMahon,Illinois,1997,Energetics of protein fluctuations; ligand binding to myoglobin and electron transfer,Uli Nienhaus
965,Jeffrey Michael Canfield,Illinois,1997,Approaching magnetic field effects in biology using the radical pair mechanism,Peter Debrunner
966,Mahmoud Khalili,Illinois Tech,1997,Photohemolysis of red blood cells by photosensitizing agents,Leonard Grossweiner
967,Sang-Ho Lee,Michigan,1997,Improvement of an empirical harmonic force field for peptides and proteins,Samuel Krimm
968,Dale William Litzenberg,Michigan,1997,PET imaging by proton radiotherapy beams,Frederick Becchetti
969,Julia Marie Stephen,Minnesota,1997,A magnetoencephalographic study of the response over the region of the auditory cortex to visual and auditory stimuli,John Broadhurst
970,Li Cai,MIT,1997,From cytosine-tetraplexes to adenine-clusters: 3D structures of DNA telomeric sequences,Alexander Rich
971,Michael R. Falvo,North Carolina,1997,Studies of the mechanics and friction of nanometer-scale materials,Richard Superfine
972,Liqiang Tao,North Dakota,1997,A Modular Distributed Source Phantom for Whole-body Counter calibration,Glenn Lykken
973,David Robert Bickel,North Texas,1997,The fractal stochastic point process model of molecular evolution and the multiplicative evolution statistical hypothesis,Bruce West
974,Hongmei Jian,NYU,1997,A combined wormlike-chain and bead model for dynamical simulations of long DNA,Tamar Schlick
975,Shannon Roy Campbell,Ohio State,1997,Synchrony and desynchrony in neural oscillators,DeLiang Wang
976,Martin Guthold,Oregon,1997,Novel scanning force microscopy methods for investigation of transcription complexes,Carlos Bustamante
977,Gerald Patrick Brady,Pennsylvania,1997,Entropy in molecular association and folding,Kim Sharp
978,Timothy Eric Holy,Princeton,1997,Physical aspects of the assembly and function of microtubules,Stanislas Leibler
979,Robert H. Carlson,Princeton,1997,Deformation activation of human leukocytes,Robert Austin
980,Viochita Maria Dadarlat,Purdue,1997,Normal mode calculation of triplet DNA,Lonnie Van Zandt
981,Sung Nam Peter Choi,Purdue,1997,Effective harmonic approach to helix proteins,Earl Prohofsky
982,Kenton Christopher Hasson,Purdue,1997,Time-resolved studies of the protein bacteriorhodopsin using femtosecond laser pulses,Philip Anfinrud
983,Pawel Piskorski,Purdue,1997,The origin of the distortion product otoacoustic emission fine structure,Arnold Tubis
984,Richard Edward Flarend,Purdue,1997,Aluminum-26 as a biological tracer using accelerator mass spectrometry,David Elmore | Stanley Hem
985,Thomas Tupper Perkins,Stanford,1997,Exploring polymer dynamics with single DNA molecules,Steven Chu
986,Christopher Anthony Wilkinson Rella,Stanford,1997,Vibrational dynamics in condensed matter systems,H. Alan Schwettman
987,Jianzhong Ding,Stony Brook,1997,The crystal structure of human adenovirus protease,Robert Sweet
988,Zhen Lin,Stony Brook,1997,A study of oligonucleotides containing abasic sites using 2D solution NMR and restrained molecular dynamics,Carlos De Los Santos
989,Jiquan Yu,Syracuse,1997,Application of multi-dimensional NMR in the study of DNA structure and dynamics,Philip Borer
990,David Mitchell Cole,Texas A&M,1997,Permanent magnet-based MRI,F. Russell Huson
991,Attila Szabo,Toledo,1997,Spectroscopic and calorimetric investigations of conformal transitions in DNA,Scott Lee
992,Brenda Jean Rowland Weiss,UC Davis,1997,X-ray absorption and infrared spectroscopy of nitrogenase,Steve Cramer
993,James Charles Strickland,UC Riverside,1997,The mathematics of form and pattern applied to plant phyllotaxis,Frederick W. Cummings
994,Kerem Yaman,UCSB,1997,Surface contributions to the entropy of macromolecules and colloids,Philip Pincus
995,Heidi Elaine Warriner,UCSB,1997,"X-ray diffraction, polarizing optical microscopy and rheological studies of lamellar gel containing polymer-surfactants",Cyrus Safinya
996,Boris Fayn,UCLA,1997,Elastic model of DNA,Joseph Rudnick
997,Kervin Orlando Evans,UAB,1998,"Dynamic characterization of 2-aminopurine in oligonucleotides using fluorescence, magnetic resonance, and Raman spectroscopies",Thomas Nordlund
998,Ranjit Pati,Albany,1998,Theory of the electronic structure and nuclear quadrupole interactions in molecular solids and semiconductor surfaces,Tara Prasad Das
999,Terence Stephen Russell,Boston University,1998,Spectroscopic investigation of the Schiff base representation mechanism of bacteriorhodopsin,Ken Rothschild
1000,Kamal Kanti Sen,Brandeis,1998,The temporal dynamics of synapses and synaptic decoding,Laurence Abbott
1001,Brian Scott Blais,Brown,1998,The role of the environment in synaptic plasticity,Leon Cooper
1002,Alyce Su,Caltech,1998,Backbone flexibility in protein design theory and experiment.,Stephen L.  Mayo
1003,Hiroyuki Fujita,Case Western,1998,Theory and design of radio frequency coils in MRI,Robert W. Brown
1004,Nikolai Gouliaev,CMU,1998,Monte Carlo simulations of membrane systems,John Nagle
1005,Horia Petrache,CMU,1998,Structure of fluid phospholipid bilayers by x-ray scattering,John Nagle
1006,Dalong Pang,George Washington,1998,Atomic force microscopy investigation of electron and neutron-induced DNA double strand breaks,Barry Berman | Anatoly Dritschilo
1007,Wily Rudolf Wriggers,Illinois,1998,"Structure, function and dynamics of cell motility proteins",Klaus Schulten
1008,Chen-Yuan Dong,Illinois,1998,Applications of pump-probe and two-photon techniques in time-resolved fluorescence microscopy and spectroscopy,Enrico Gratton
1009,Wiliam Brian Hyslop,Illinois,1998,Magnetic resonance microscopy,Paul Lauterbur
1010,Steven Plotkin,Illinois,1998,Physical models of protein folding within the energy landscape theory,Peter Wolynes
1011,Manuel-Angel Balsera,Illinois,1998,Mesoscopic modeling of protein conformational changes,Yoshitsugu Oono
1012,Kon Ho Lee,Johns Hopkins,1998,"Structure, specificity and affinity maturation of anti-nitrophenol antibody Mab88C6/12",L. Mario Amzel
1013,Mark W.F. Fischer,Michigan,1998,Local motions of proteins detected by NMR relaxation,Samuel Krimm
1014,Michael Kevin Lewis,Michigan,1998,Development of near-field studies of single biomolecules,Duncan Steel | Ari Gafni
1015,James David Hamilton,Michigan,1998,High frequency ultrasound imaging using optics,Matthew O’Donnell
1016,Neer Asherie,MIT,1998,The phase diagram of globular protein solutions : the role of the range of interaction,George Benedek
1017,Andrew Joshua Berger,MIT,1998,Measurement of analytes in human serum by near-infrared Raman spectroscopy,Michael S. Feld
1018,George I. Zonios,MIT,1998,Diffuse reflectance spectroscopy of human colon tissue,Michael S. Feld
1019,Vance Reid Pomeroy,New Hampshire,1998,Spin-exchange polarized (3)He using optically pumped alkali atoms for magnetic resonance imaging and neutron spin-filters,F. William Hersman
1020,Christopher Scarfone,North Carolina State,1998,Quantitative pulmonary single photon emission computed tomography with radiotherapy applications,Dale Sayers | Ronald Jaszczak
1021,Frank Gibbons,Northeastern,1998,A Dynamical model of kinesin-microtubule motility arrays,Jorge Jose
1022,Yi Jiang,Notre Dame,1998,Cellular pattern formation,James Glazier
1023,Paolo Allegrini,North Texas,1998,Model for long-range correlations in DNA sequences,Paolo Grigolini
1024,Samuel P. Walker IV,Oregon,1998,Quantitative applications of scanning force microscopy: investigation of the TATA box-binding protein-DNA complex,Brian W. Matthews
1025,Nadine Gassner,Oregon,1998,Structural and kinetic analysis of T4 lysozyme variants,Brian W. Matthews
1026,Rhett Kovall,Oregon,1998,Structural and functional studies of lambda-exonuclease,Brian W. Matthews
1027,Kuo-Chung Hsu,Oregon,1998,Bacteriorhodopsin as a holographic data storage device,George Rayfield
1028,Yujia Cui,Oregon,1998,The elasticity of single DNA molecules and chromatin fibers determined by force-measuring laser tweezers,Carlos Bustamante
1029,John David Moroz,Pennsylvania,1998,The statistical mechanics of twist-storing polymers,Philip Nelson
1030,Xingde Li,Pennsylvania,1998,Fluorescence and diffuse wave diffraction tomographic probes in turbid media,Arjun Yodh
1031,H. Michael Gach,Pittsburgh,1998,MRI of flow using the rotating ultra-fast imaging sequence,Irving J. Lowe
1032,Seth Daniel Bruder,Princeton,1998,Predictive information in spike trains from the blowfly and monkey visual systems,William Bialek
1033,Christopher H. Wiggins,Princeton,1998,Elastohydrodynamics in the Biological Context,Ray Goldstein
1034,Andrew G. Jeung,Stanford,1998,Analyses of biological systems using scanning near-field infrared microscopy,Todd Smith
1035,Zhongmin Jin,Stony Brook,1998,X-ray strudture of recombinant equine infectious anaemia virus capsid protein p26,Catherine L. Lawson
1036,Wei Ding,Stony Brook,1998,X-ray structure analysis of a neutralizing epitope in Lyme disease antigen OspA,Catherine L. Lawson
1037,Yuxin Wang,Stony Brook,1998,3D imaging in soft x-ray microscopy,Chris Jacobsen
1038,Miguel Maravall,Stony Brook,1998,Studies in computational neuroscience: aspects of memory and neuronal function,Robert Shrock
1039,Jeffrey Alan Stuart,Syracuse,1998,Part I. Bacteriorhodopsin-related materials work for molecular electronics. Part II. Volumetric optical memory based on the branched photocycle of bacteriorhodopsin. Part III. The role of calcium in the bacteriorhodopsin binding site,Robert R. Birge
1040,Diek Winters Wheeler,Texas,1998,Nonlinear behavior in small neural sytems,William C. Scheive
1041,Ilya Koltover,UCSB,1998,Structure and interactions in biomaterials based on membrane-biopolymer self-assembly,Cyrus Safinya
1042,Jason Luther Smart,UCSD,1998,Application of Continuum Electrostatics and Diffusional Models to Biomolecular Systems,Jose Onuchic
1043,Craig Dustin Patten,UCSD,1998,Structure and function of voltage-gated potassium channels,Jose Onuchic | Mauricio Montal
1044,Royce Hamilton Kam,UCSD,1998,Tip growth mechanisms in unicellular morphogenesis,Herbert Levine
1045,Robert Ward Cutler III,Vanderbilt,1998,Local region sampling (LRS): A method to predict protein coding regions,Thomas Kephart
1046,John Raymond Dennis,Washington,1998,Mechanisms of liquid crystal and biopolymer alignment on highly-oriented polymer thin films,Viola Vogel
1047,Kevin Thomas Gahagan,Worcester Polytechnic,1998,Optical manipulation of microparticles and biological structures,Grover A. Swartzlander |  Jr.
1048,Hui Wang,Albany,1999,Polycapillary x-ray collimating lenses for medical imaging,Carolyn McDonald
1049,Minakhi Pujari,Albany,1999,First-principles investigation of electronic structure and hyperfine properties of heme and nitrosyl-hemoglobin systems,Tara Prasad Das
1050,Plamen Ivanov,Boston University,1999,Scaling Features of in Human Heartbeat Dynamics,H. Eugene Stanley
1051,Nikolay V. Dokholyan,Boston University,1999,Applications of Statistical Mechanics to Biological Macromolecules,H. Eugene Stanley
1052,Yanhui Liu,Boston University,1999,Abnormal Fluctuations in Physiological Systems,H. Eugene Stanley
1053,Predrag Neskovic,Brown,1999,"Feedforward, feedback neural networks",Leon Cooper
